{
  "$schema": "../../schema/event_registry.schema.json",
  "registry_schema_version": "v0.1.0",
  "registry_version": "v0.7.0",
  "benchmark_release_line": "v0.7",
  "effective_benchmark_version": "v0.7.0",
  "wave_id": "anx_us_2026w07_cross_domain_bridge",
  "registry_status": "frozen",
  "registry_lock_date": "2026-06-16",
  "outcome_inspection_status": "not_inspected",
  "events": [
    {
      "event_id": "no_event",
      "event_name": "No AI capability event assigned to Wave 7 cross-domain bridge",
      "category": "no_event",
      "event_description": "This registry records that anx_us_2026w07_cross_domain_bridge is a non-event psychometric bridge wave for cross-domain linking among somatic_ambient_anxiety, economic_vocational_anxiety, and epistemic_trust_anxiety. It is intentionally not anchored to a frontier model release, capability demonstration, labor-market announcement, deepfake incident, misinformation incident, platform-policy change, regulatory action, public safety event, benchmark release, or any other time-localized AI event. The registry is locked so Wave 7 responses cannot later be retrofitted into an event-study exposure design after outcome inspection.",
      "event_timestamp": null,
      "timestamp_source_url": null,
      "timestamp_source_type": "not_applicable_no_event",
      "exposure_window": null,
      "baseline_window": null,
      "follow_up_windows": [],
      "affected_domains": [],
      "competing_events": [],
      "lock_date": "2026-06-16",
      "amendment_history": []
    }
  ]
}
