{
  "$schema": "../../schema/event_registry.schema.json",
  "registry_schema_version": "v0.1.0",
  "registry_version": "v0.2.1",
  "benchmark_release_line": "v0.2",
  "effective_benchmark_version": "v0.2.1",
  "wave_id": "anx_us_2026w02_somatic",
  "registry_status": "frozen",
  "registry_lock_date": "2026-06-15",
  "outcome_inspection_status": "not_inspected",
  "events": [
    {
      "event_id": "no_event",
      "event_name": "No AI capability event assigned to Wave 2 somatic calibration",
      "category": "no_event",
      "event_description": "This registry records that the anx_us_2026w02_somatic fielding packet is a non-event psychometric calibration wave. It is intentionally not anchored to a frontier model release, capability demonstration, AI safety incident, labor market announcement, policy action, misinformation incident, or infrastructure access change.",
      "event_timestamp": null,
      "timestamp_source_url": null,
      "timestamp_source_type": "not_applicable_no_event",
      "exposure_window": null,
      "baseline_window": null,
      "follow_up_windows": [],
      "affected_domains": [],
      "competing_events": [],
      "lock_date": "2026-06-15",
      "amendment_history": []
    }
  ]
}
